{
  "schemaVersion": "1.0",
  "objective": "generar-consultas",
  "funnelStage": "consideracion",
  "campaign": {
    "id": "invierno-2026",
    "name": "Antes del Invierno",
    "theme": "confort termico"
  },
  "author": "creative-os",
  "reviewedBy": ["brand-guardian", "quality-controller"],
  "createdAt": "2026-07-01",
  "version": "1.0",
  "language": "es-AR",
  "branding": {
    "brandId": "alumfer",
    "voiceProfile": "artesano",
    "palette": "modo-oscuro",
    "logoUsage": "cierre-solamente"
  },
  "priority": "alta",
  "compatiblePlatforms": ["instagram", "facebook"],
  "primaryPlatform": "instagram",
  "publication": {
    "type": "carrusel",
    "category": "educativo-transformacion",
    "duration": null,
    "aspectRatio": "4:5",
    "slideCount": 4
  },
  "geo": {
    "zone": "Zona Sur GBA",
    "neighborhood": "Quilmes"
  },
  "scheduling": {
    "suggestedWindow": "miercoles 19:00-21:00",
    "seasonalRelevance": "otoño-pre-invierno"
  }
}
